{"schema_version":2,"node":{"id":"de-fra-1","role":"exit","country":"DE","city":"Frankfurt"},"server":{"hostname":"exit","public_ip":"198.51.100.20","domain":"de-exit.example.com","timezone":"UTC"},"network":{"public_port":443,"xhttp":{"listen":"127.0.0.1","port":20000,"path":"/api/base-example/"},"subscription":{"path":"/sub/base-example/","mode":"generated"}},"panel":{"listen_port":52000,"path":"/panel/base-example/","username":"admin","password":"secret","api_auth":{"mode":"bearer","token_name":"test","token":"secret-token"}},"clients":[],"exits":[],"routes":[],"relay_peers":[]}
