{"schema_version":2,"node":{"id":"ru-msk-1","role":"entry","country":"RU","city":"Moscow"},"server":{"hostname":"entry","public_ip":"203.0.113.10","domain":"ru-entry.example.com","timezone":"UTC"},"network":{"public_port":443,"xhttp":{"listen":"127.0.0.1","port":20000,"path":"/api/base-example/"},"subscription":{"path":"/sub/base-example/","mode":"generated"}},"panel":{"listen_port":52000,"path":"/panel/base-example/","username":"admin","password":"secret","api_auth":{"mode":"bearer","token_name":"test","token":"secret-token"}},"clients":[{"id":"client-1","name":"Client-1","subscription_id":"sub-client-1","enabled":true,"credentials":[]}],"exits":[],"routes":[],"relay_peers":[]}
